{
  "id": "module-04",
  "title": "Module 4: Functional & Concurrent Java",
  "description": "Unlock modern Java with Lambdas, Streams, Threads, and Executors.",
  "lessons": [
    {
      "id": "lesson-04-streams-threads",
      "title": "Lambdas, Streams, Threads, and Concurrency",
      "theoryMarkdown": "# Functional and Concurrent Programming\n\n## Lambdas and Streams\nLambdas provide a clear and concise way to represent one-method interfaces using an expression. The Stream API lets you process collections declaratively.\n\n```java\nList<Integer> nums = List.of(1, 2, 3, 4, 5);\nint sum = nums.stream()\n              .filter(n -> n % 2 == 0)\n              .mapToInt(Integer::intValue)\n              .sum(); // 6\n```\n\n## Threads and Concurrency\nThreads allow parallel execution. You can create custom threads or use `ExecutorService`. Virtual Threads (Java 21) are lightweight threads that dramatically reduce the effort of writing high-throughput concurrent apps.\nTo prevent data corruption in shared memory, use `synchronized`, `Atomics`, or `ReentrantLock`.\n\n**Common Mistakes:** \n- Modifying a stateful variable inside a Stream lambda (streams should be stateless/pure).\n- Forgetting to `shutdown()` an ExecutorService.\n\n**Recap:** You've learned to write functional data pipelines and manage parallel execution.",
      "exercises": [
        {
          "id": "ex-10-streams-mc",
          "title": "Stream Terminals",
          "type": "multipleChoice",
          "instructionMarkdown": "In the Stream API, what is the difference between `map` and `collect`?",
          "choices": ["`map` is an intermediate operation; `collect` is a terminal operation.", "`map` executes immediately, while `collect` is lazy."],
          "correctChoice": 0
        },
        {
          "id": "ex-11-streams-func",
          "title": "Filter and Sum",
          "type": "function",
          "instructionMarkdown": "Write a function `sumOfSquares` that takes an `int[]`. Return the sum of the squares of all elements that are strictly greater than 3.",
          "hints": [
            "Loop through the array or use `Arrays.stream(nums)`.",
            "Filter for `n > 3`.",
            "Map `n` to `n * n` and sum."
          ],
          "limits": {
            "timeoutMs": 3000,
            "memoryMb": 256,
            "maxOutputKb": 64
          },
          "starterFiles": [
            {
              "path": "Solution.java",
              "content": "public class Solution {\n    public static int sumOfSquares(int[] nums) {\n        return 0;\n    }\n}\n"
            }
          ],
          "entrypoint": {
            "kind": "function",
            "className": "Solution",
            "name": "sumOfSquares",
            "parameters": [
              {
                "name": "nums",
                "type": "int[]"
              }
            ],
            "returns": "int"
          },
          "tests": [
            {
              "id": "test-stream-1",
              "visibility": "public",
              "arguments": [[1, 2, 4, 5]],
              "expected": 41
            },
            {
              "id": "test-stream-2",
              "visibility": "public",
              "arguments": [[1, 2, 3]],
              "expected": 0
            },
            {
              "id": "test-hidden-stream-1",
              "visibility": "hidden",
              "arguments": [[4]],
              "expected": 16
            },
            {
              "id": "test-hidden-stream-2",
              "visibility": "hidden",
              "arguments": [[10, -5, 0]],
              "expected": 100
            }
          ]
        },
        {
          "id": "ex-12-thread-debug",
          "title": "Debug: Starting a Thread",
          "type": "debug",
          "instructionMarkdown": "Fix the code to actually start the thread concurrently instead of just calling its run method synchronously.",
          "hints": [
            "Calling `run()` directly runs the code on the main thread.",
            "Use `start()` to spawn a new execution thread."
          ],
          "limits": {
            "timeoutMs": 3000,
            "memoryMb": 256,
            "maxOutputKb": 64
          },
          "starterFiles": [
            {
              "path": "Main.java",
              "content": "public class Main {\n    public static void main(String[] args) {\n        Thread t = new Thread(() -> System.out.print(\"ThreadTask\"));\n        t.run(); // Fix this to actually start a new thread.\n    }\n}\n"
            }
          ],
          "tests": [
            {
              "id": "test-thread-start",
              "visibility": "public",
              "input": "",
              "expected": "ThreadTask"
            }
          ]
        }
      ]
    }
  ]
}
