{
  "id": "module-02",
  "title": "Module 2: Object-Oriented Programming",
  "description": "Master Classes, Inheritance, Interfaces, Polymorphism, and Enums.",
  "lessons": [
    {
      "id": "lesson-02-oop-concepts",
      "title": "Classes, Inheritance, Interfaces, and Enums",
      "theoryMarkdown": "# Object-Oriented Programming\n\nJava uses OOP to model real-world concepts.\n\n## Classes and Objects\nA class is a blueprint; an object is an instance. Use constructors to initialize fields.\n\n```java\npublic class User {\n    private String name; // Encapsulation\n\n    public User(String name) {\n        this.name = name;\n    }\n}\n```\n\n## Inheritance and Interfaces\nInheritance (`extends`) allows creating child classes. Polymorphism lets you treat a child as its parent. Interfaces (`implements`) define a contract.\n\n```java\npublic interface Runnable { void run(); }\npublic class Dog implements Runnable {\n    @Override\n    public void run() { System.out.println(\"Dog runs\"); }\n}\n```\nEnums group constants, e.g., `enum Status { ACTIVE, INACTIVE }`.\n\n**Common Mistakes:** \n- Forgetting `@Override`, leading to accidental overloading instead of overriding.\n- Trying to instantiate an interface or abstract class.\n\n**Recap:** You understand state/behavior, inheritance trees, interfaces, and constant groupings (enums).",
      "exercises": [
        {
          "id": "ex-04-oop-mc",
          "title": "Interface vs Abstract Class",
          "type": "multipleChoice",
          "instructionMarkdown": "Which of the following is true about interfaces in Java 21?",
          "choices": ["They cannot have any method implementations.", "A class can implement multiple interfaces.", "They are instantiated using the `new` keyword directly."],
          "correctChoice": 1
        },
        {
          "id": "ex-05-oop-func",
          "title": "Polymorphic Formatter",
          "type": "function",
          "instructionMarkdown": "Create a function `formatGreeting` that takes a `string` (name) and `boolean` (isFormal). If formal, return 'Good day, [name]'. Otherwise return 'Hi, [name]'.",
          "hints": [
            "Use a simple `if/else` block or ternary operator.",
            "String concatenation can be done with `+`."
          ],
          "limits": {
            "timeoutMs": 3000,
            "memoryMb": 256,
            "maxOutputKb": 64
          },
          "starterFiles": [
            {
              "path": "Solution.java",
              "content": "public class Solution {\n    public static String formatGreeting(String name, boolean isFormal) {\n        return \"\";\n    }\n}\n"
            }
          ],
          "entrypoint": {
            "kind": "function",
            "className": "Solution",
            "name": "formatGreeting",
            "parameters": [
              {
                "name": "name",
                "type": "string"
              },
              {
                "name": "isFormal",
                "type": "boolean"
              }
            ],
            "returns": "string"
          },
          "tests": [
            {
              "id": "test-formal",
              "visibility": "public",
              "arguments": ["Alice", true],
              "expected": "Good day, Alice"
            },
            {
              "id": "test-informal",
              "visibility": "public",
              "arguments": ["Bob", false],
              "expected": "Hi, Bob"
            },
            {
              "id": "test-hidden-formal",
              "visibility": "hidden",
              "arguments": ["Charlie", true],
              "expected": "Good day, Charlie"
            },
            {
              "id": "test-hidden-informal",
              "visibility": "hidden",
              "arguments": ["Diana", false],
              "expected": "Hi, Diana"
            }
          ]
        },
        {
          "id": "ex-06-oop-debug",
          "title": "Debug: Method Overriding",
          "type": "debug",
          "instructionMarkdown": "Fix the child class so it correctly overrides the parent method and outputs 'Child print'.",
          "hints": [
            "Check the method signature (name and parameters).",
            "The method name must match exactly."
          ],
          "limits": {
            "timeoutMs": 3000,
            "memoryMb": 256,
            "maxOutputKb": 64
          },
          "starterFiles": [
            {
              "path": "Main.java",
              "content": "class Parent { public void printInfo() { System.out.print(\"Parent\"); } }\nclass Child extends Parent { public void printinfo() { System.out.print(\"Child print\"); } }\npublic class Main {\n    public static void main(String[] args) {\n        Parent obj = new Child();\n        obj.printInfo();\n    }\n}\n"
            }
          ],
          "tests": [
            {
              "id": "test-debug-oop",
              "visibility": "public",
              "input": "",
              "expected": "Child print"
            }
          ]
        }
      ]
    }
  ]
}
