{
  "id": "module-05",
  "title": "Module 5: I/O, Testing & Debugging",
  "description": "Handle files, write JUnit tests, and master the debugger.",
  "lessons": [
    {
      "id": "lesson-05-io-tests-logs",
      "title": "File I/O, Unit Testing, Logging, and Debugging",
      "theoryMarkdown": "# System Integration\n\n## File I/O and Streams\nJava provides the `java.io` package (Input/Output streams, `File`) and `java.nio.file` (`Files`, `Path`) for reading and writing data to disk. \n\n## Unit Testing & Logging\nBugs happen. **Unit testing** (using JUnit) verifies individual methods. Annotations like `@Test` mark test cases.\n**Logging** (using standard logger or Logback) records events during execution, better than `System.out.println` because logs have levels (INFO, DEBUG, ERROR).\n\n## Debugging\nIf a test fails, you use a Debugger to pause execution (breakpoints), step over code, and inspect the call stack and variable memory.\n\n**Common Mistakes:** \n- Leaving files unclosed (always use try-with-resources).\n- Testing too many things in a single unit test (violates single responsibility).\n\n**Recap:** You've learned how to interact with the file system, test your logic, and log application states.",
      "exercises": [
        {
          "id": "ex-13-io-mc",
          "title": "Try-With-Resources",
          "type": "multipleChoice",
          "instructionMarkdown": "What is the primary benefit of the try-with-resources statement when handling files?",
          "choices": ["It automatically closes the resource when the block exits.", "It automatically parses JSON data."],
          "correctChoice": 0
        },
        {
          "id": "ex-14-parse-func",
          "title": "Log Parser Simulator",
          "type": "function",
          "instructionMarkdown": "Simulate reading a log file. Given a `string[]` of log lines, return the count of lines that start with \"ERROR\".",
          "hints": [
            "Iterate through the array.",
            "Use the `startsWith()` method on each string.",
            "Keep a counter."
          ],
          "limits": {
            "timeoutMs": 3000,
            "memoryMb": 256,
            "maxOutputKb": 64
          },
          "starterFiles": [
            {
              "path": "Solution.java",
              "content": "public class Solution {\n    public static int countErrors(String[] logs) {\n        return 0;\n    }\n}\n"
            }
          ],
          "entrypoint": {
            "kind": "function",
            "className": "Solution",
            "name": "countErrors",
            "parameters": [
              {
                "name": "logs",
                "type": "string[]"
              }
            ],
            "returns": "int"
          },
          "tests": [
            {
              "id": "test-log-1",
              "visibility": "public",
              "arguments": [["INFO: Started", "ERROR: Crash", "WARN: Slow", "ERROR: DB Failed"]],
              "expected": 2
            },
            {
              "id": "test-log-2",
              "visibility": "public",
              "arguments": [["INFO: OK"]],
              "expected": 0
            },
            {
              "id": "test-hidden-log-1",
              "visibility": "hidden",
              "arguments": [["ERROR: 1", "ERROR: 2", "ERROR: 3"]],
              "expected": 3
            },
            {
              "id": "test-hidden-log-2",
              "visibility": "hidden",
              "arguments": [[]],
              "expected": 0
            }
          ]
        },
        {
          "id": "ex-15-test-debug",
          "title": "Debug: Unit Test Logic",
          "type": "debug",
          "instructionMarkdown": "This mock test method is checking an addition function, but it fails. Fix the hardcoded expectation to make the test pass.",
          "hints": [
            "2 + 2 equals 4, not 5."
          ],
          "limits": {
            "timeoutMs": 3000,
            "memoryMb": 256,
            "maxOutputKb": 64
          },
          "starterFiles": [
            {
              "path": "Main.java",
              "content": "public class Main {\n    public static void main(String[] args) {\n        int result = add(2, 2);\n        if (result == 5) { // Fix the expected value here\n            System.out.print(\"PASS\");\n        } else {\n            System.out.print(\"FAIL\");\n        }\n    }\n    static int add(int a, int b) { return a + b; }\n}\n"
            }
          ],
          "tests": [
            {
              "id": "test-debug-test",
              "visibility": "public",
              "input": "",
              "expected": "PASS"
            }
          ]
        }
      ]
    }
  ]
}
