{
  "id": "module-01",
  "title": "Module 1: Java Fundamentals & Control Flow",
  "description": "Learn the JVM, primitive types, control flow, loops, and basic array processing.",
  "lessons": [
    {
      "id": "lesson-01-jvm-types-loops-arrays",
      "title": "JVM, JRE, JDK, Literals, Variables, Loops & Arrays",
      "theoryMarkdown": "# Java Fundamentals\n\nWelcome to Java! The Java ecosystem consists of the **JVM** (Java Virtual Machine, which runs the code), **JRE** (Java Runtime Environment, which includes the JVM and standard libraries), and the **JDK** (Java Development Kit, which adds tools like the compiler `javac`).\n\n## Data Types and Variables\nJava is strongly typed. Primitives include `int`, `double`, `boolean`, and `char`. \n\n```java\nint age = 25;\ndouble price = 19.99;\nboolean isValid = true;\n```\n\n## Control Flow & Arrays\nConditional statements (`if`, `switch`) and loops (`for`, `while`, `do-while`) control execution.\nArrays hold fixed-size collections of a single type.\n\n```java\nint[] numbers = {1, 2, 3, 4, 5};\nfor (int i = 0; i < numbers.length; i++) {\n    if (numbers[i] % 2 == 0) {\n        System.out.println(numbers[i] + \" is even\");\n    }\n}\n```\n\n**Common Mistakes:** \n- Off-by-one errors in loops (e.g., `i <= numbers.length` throws `ArrayIndexOutOfBoundsException`).\n- Confusing `=` (assignment) with `==` (comparison).\n\n**Recap:** You've seen JVM components, basic types, conditionals, loops, and arrays.",
      "exercises": [
        {
          "id": "ex-01-jvm-mc",
          "title": "JVM Components",
          "type": "multipleChoice",
          "instructionMarkdown": "Which component is strictly responsible for executing the compiled Java bytecode?",
          "choices": ["JDK", "JVM", "IDE"],
          "correctChoice": 1
        },
        {
          "id": "ex-02-array-func",
          "title": "Sum of Evens",
          "type": "function",
          "instructionMarkdown": "Write a function `sumEvens` that takes an array of integers and returns the sum of all even numbers.",
          "hints": [
            "Use a `for` loop to iterate through the array.",
            "Use the modulo operator `%` to check if a number is even.",
            "Keep a running total in an `int` variable."
          ],
          "limits": {
            "timeoutMs": 3000,
            "memoryMb": 256,
            "maxOutputKb": 64
          },
          "starterFiles": [
            {
              "path": "Solution.java",
              "content": "public class Solution {\n    public static int sumEvens(int[] nums) {\n        return 0;\n    }\n}\n"
            }
          ],
          "entrypoint": {
            "kind": "function",
            "className": "Solution",
            "name": "sumEvens",
            "parameters": [
              {
                "name": "nums",
                "type": "int[]"
              }
            ],
            "returns": "int"
          },
          "tests": [
            {
              "id": "test-public-1",
              "visibility": "public",
              "arguments": [[1, 2, 3, 4]],
              "expected": 6
            },
            {
              "id": "test-public-2",
              "visibility": "public",
              "arguments": [[10, 15, 20]],
              "expected": 30
            },
            {
              "id": "test-hidden-1",
              "visibility": "hidden",
              "arguments": [[1, 3, 5]],
              "expected": 0
            },
            {
              "id": "test-hidden-2",
              "visibility": "hidden",
              "arguments": [[-2, 4, -6]],
              "expected": -4
            }
          ]
        },
        {
          "id": "ex-03-loop-debug",
          "title": "Debug: Array Reversal",
          "type": "debug",
          "instructionMarkdown": "Fix the loop condition so it successfully prints the array backwards without crashing.",
          "hints": [
            "Arrays are zero-indexed.",
            "If an array has size 3, the highest index is 2."
          ],
          "limits": {
            "timeoutMs": 3000,
            "memoryMb": 256,
            "maxOutputKb": 64
          },
          "starterFiles": [
            {
              "path": "Main.java",
              "content": "public class Main {\n    public static void main(String[] args) {\n        int[] arr = {1, 2, 3};\n        for (int i = arr.length; i > 0; i--) {\n            System.out.print(arr[i]);\n        }\n    }\n}\n"
            }
          ],
          "tests": [
            {
              "id": "test-debug-1",
              "visibility": "public",
              "input": "",
              "expected": "321"
            }
          ]
        }
      ]
    }
  ]
}
